{
  "page_id": "value-simulator",
  "title": "Estimate the value of governed AI engineering",
  "source_sketch": "в”Ңв”Җв”Җв”Җв”Җв”Җв”Җв”Җв”Җв”Җв”Җв”Җв”Җв”Җв”Җв”Җв”Җв”Җв”Җв”Җв”Җв”Җв”Җв”Җв”Җв”Җв”Җв”Җв”Җв”Җв”Җв”Җв”Җв”Җв”Җв”Җв”Җв”Җв”Җв”Җв”Җв”Җв”Җв”Җв”Җв”Җв”Җв”Җв”Җв”Җв”Җв”Җв”Җв”Җв”Җв”Җв”Җв”Җв”Җв”Җв”Җв”җ\nв”Ӯ HERO: Estimate the value of governed AI engineering        в”Ӯ\nв”ңв”Җв”Җв”Җв”Җв”Җв”Җв”Җв”Җв”Җв”Җв”Җв”Җв”Җв”Җв”Җв”Җв”Җв”Җв”Җв”Җв”Җв”Җв”Җв”¬в”Җв”Җв”Җв”Җв”Җв”Җв”Җв”Җв”Җв”Җв”Җв”Җв”Җв”Җв”Җв”Җв”Җв”Җв”Җв”Җв”Җв”Җв”Җв”Җв”Җв”Җв”Җв”Җв”Җв”Җв”Җв”Җв”Җв”Җв”Җв”Җв”Ө\nв”Ӯ SEGMENT PICKER        в”Ӯ VALUE SIMULATOR                    в”Ӯ\nв”Ӯ Enterprise / MSP / AI в”Ӯ Inputs + annual value opportunity  в”Ӯ\nв”ңв”Җв”Җв”Җв”Җв”Җв”Җв”Җв”Җв”Җв”Җв”Җв”Җв”Җв”Җв”Җв”Җв”Җв”Җв”Җв”Җв”Җв”Җв”Җв”ҙв”Җв”Җв”Җв”Җв”Җв”Җв”Җв”Җв”Җв”Җв”Җв”Җв”Җв”Җв”Җв”Җв”Җв”Җв”Җв”Җв”Җв”Җв”Җв”Җв”Җв”Җв”Җв”Җв”Җв”Җв”Җв”Җв”Җв”Җв”Җв”Җв”Ө\nв”Ӯ FORMULA + ASSUMPTIONS                                      в”Ӯ\nв”ңв”Җв”Җв”Җв”Җв”Җв”Җв”Җв”Җв”Җв”Җв”Җв”Җв”Җв”Җв”Җв”Җв”Җв”Җв”Җв”Җв”Җв”Җв”Җв”¬в”Җв”Җв”Җв”Җв”Җв”Җв”Җв”Җв”Җв”Җв”Җв”Җв”Җв”Җв”Җв”Җв”Җв”Җв”Җв”Җв”Җв”Җв”Җв”Җв”Җв”Җв”Җв”Җв”Җв”Җв”Җв”Җв”Җв”Җв”Җв”Җв”Ө\nв”Ӯ MARKET CITATIONS      в”Ӯ LOC EVIDENCE CHAIN                 в”Ӯ\nв”ңв”Җв”Җв”Җв”Җв”Җв”Җв”Җв”Җв”Җв”Җв”Җв”Җв”Җв”Җв”Җв”Җв”Җв”Җв”Җв”Җв”Җв”Җв”Җв”ҙв”Җв”Җв”Җв”Җв”Җв”Җв”Җв”Җв”Җв”Җв”Җв”Җв”Җв”Җв”Җв”Җв”Җв”Җв”Җв”Җв”Җв”Җв”Җв”Җв”Җв”Җв”Җв”Җв”Җв”Җв”Җв”Җв”Җв”Җв”Җв”Җв”Ө\nв”Ӯ LIMITATIONS + TRANSFORMATION REVIEW CTA                    в”Ӯ\nв””в”Җв”Җв”Җв”Җв”Җв”Җв”Җв”Җв”Җв”Җв”Җв”Җв”Җв”Җв”Җв”Җв”Җв”Җв”Җв”Җв”Җв”Җв”Җв”Җв”Җв”Җв”Җв”Җв”Җв”Җв”Җв”Җв”Җв”Җв”Җв”Җв”Җв”Җв”Җв”Җв”Җв”Җв”Җв”Җв”Җв”Җв”Җв”Җв”Җв”Җв”Җв”Җв”Җв”Җв”Җв”Җв”Җв”Җв”Җв”Җв”ҳ",
  "zones": [
    {
      "zone_id": "hero",
      "label": "HERO: Estimate the value of governed AI engineering",
      "purpose": "Estimate the value of governed AI engineering",
      "details": [],
      "layout_role": "full_width",
      "bounds": {
        "band": 0,
        "column": 0,
        "column_count": 1,
        "x": 1,
        "y": 1,
        "width": 60,
        "height": 1
      }
    },
    {
      "zone_id": "segment-picker",
      "label": "SEGMENT PICKER",
      "purpose": "",
      "details": [
        "Enterprise / MSP / AI"
      ],
      "layout_role": "split_left",
      "bounds": {
        "band": 1,
        "column": 0,
        "column_count": 2,
        "x": 1,
        "y": 3,
        "width": 23,
        "height": 2
      }
    },
    {
      "zone_id": "value-simulator",
      "label": "VALUE SIMULATOR",
      "purpose": "",
      "details": [
        "Inputs + annual value opportunity"
      ],
      "layout_role": "split_right",
      "bounds": {
        "band": 1,
        "column": 1,
        "column_count": 2,
        "x": 25,
        "y": 3,
        "width": 36,
        "height": 2
      }
    },
    {
      "zone_id": "formula-assumptions",
      "label": "FORMULA + ASSUMPTIONS",
      "purpose": "",
      "details": [],
      "layout_role": "full_width",
      "bounds": {
        "band": 2,
        "column": 0,
        "column_count": 1,
        "x": 1,
        "y": 6,
        "width": 60,
        "height": 1
      }
    },
    {
      "zone_id": "market-citations",
      "label": "MARKET CITATIONS",
      "purpose": "",
      "details": [],
      "layout_role": "split_left",
      "bounds": {
        "band": 3,
        "column": 0,
        "column_count": 2,
        "x": 1,
        "y": 8,
        "width": 23,
        "height": 1
      }
    },
    {
      "zone_id": "loc-evidence-chain",
      "label": "LOC EVIDENCE CHAIN",
      "purpose": "",
      "details": [],
      "layout_role": "split_right",
      "bounds": {
        "band": 3,
        "column": 1,
        "column_count": 2,
        "x": 25,
        "y": 8,
        "width": 36,
        "height": 1
      }
    },
    {
      "zone_id": "limitations-transformation-review-cta",
      "label": "LIMITATIONS + TRANSFORMATION REVIEW CTA",
      "purpose": "",
      "details": [],
      "layout_role": "full_width",
      "bounds": {
        "band": 4,
        "column": 0,
        "column_count": 1,
        "x": 1,
        "y": 10,
        "width": 60,
        "height": 1
      }
    }
  ]
}
